{
  "id": "W3",
  "name": "market-project",
  "version": 1,
  "description": "Research, position, plan, and draft the first marketing campaign.",
  "autonomy": "assisted",
  "acceptance": ["Persona and competitor reports pass the depth gate.", "The plan includes budget math.", "The first week's content is in the conversation language.", "Nothing is published without approval."],
  "steps": [
    { "id": "s1", "runner": "gemini-inline", "prompt": "Collect the business intake and product classification questions.", "input": { "project": "{{brief.project}}", "goal": "{{brief.goal}}" }, "needs": [], "gate": "none", "autonomy": "assisted", "acceptance": ["The marketing brief is explicit."] },
    { "id": "s2", "runner": "codex-scout", "prompt": "Research the dream buyer persona in multiple languages, including forums and reviews.", "input": { "project": "{{brief.project}}", "goal": "{{brief.goal}}" }, "needs": ["s1"], "gate": "none", "autonomy": "assisted", "acceptance": ["The persona research passes the depth gate."], "research": true },
    { "id": "s3", "runner": "codex-scout", "prompt": "Study at least five competitors and collect multilingual evidence.", "input": { "project": "{{brief.project}}", "goal": "{{brief.goal}}" }, "needs": ["s1"], "gate": "none", "autonomy": "assisted", "acceptance": ["The competitor research passes the depth gate."], "research": true },
    { "id": "s4", "runner": "claude-skill", "skill": "performance-marketer", "input": { "brief": "{{steps.s1.out}}", "persona": "{{steps.s2.out}}", "competitors": "{{steps.s3.out}}" }, "needs": ["s2", "s3"], "gate": "review", "autonomy": "assisted", "acceptance": ["The persona, market gap, and offer are sourced."] },
    { "id": "s5", "runner": "claude-skill", "skill": "marketing-plan", "input": { "offer": "{{steps.s4.out}}", "brief": "{{steps.s1.out}}" }, "needs": ["s4"], "gate": "review", "autonomy": "assisted", "acceptance": ["The plan has thirteen sections and budget math."] },
    { "id": "s6", "runner": "claude-skill", "skill": "social", "input": { "plan": "{{steps.s5.out}}", "project": "{{brief.project}}" }, "needs": ["s5"], "gate": "review", "autonomy": "assisted", "acceptance": ["The first week's content and campaign variants exist."] },
    { "id": "s7", "runner": "claude-skill", "skill": "carousel-studio", "input": { "content": "{{steps.s6.out}}" }, "needs": ["s6"], "gate": "approve", "autonomy": "assisted", "acceptance": ["The first three carousel drafts are ready before publishing."] },
    { "id": "s8", "runner": "claude-skill", "skill": "analytics", "input": { "plan": "{{steps.s5.out}}" }, "needs": ["s5"], "gate": "review", "autonomy": "assisted", "acceptance": ["A tracking plan and welcome sequence are ready."] },
    { "id": "s9", "runner": "claude-skill", "skill": "copy-editing", "input": { "content": "{{steps.s6.out}}", "creative": "{{steps.s7.out}}", "tracking": "{{steps.s8.out}}" }, "needs": ["s6", "s7", "s8"], "gate": "none", "autonomy": "assisted", "acceptance": ["Outward copy receives copy-editing, stop-slop, and fact-checking."] },
    { "id": "s10", "runner": "gemini-inline", "prompt": "Queue only the posts that were approved and schedule the next content batch.", "input": { "approved": "{{steps.s9.out}}" }, "needs": ["s9"], "gate": "approve", "autonomy": "assisted", "acceptance": ["No post is queued without explicit approval."] }
  ]
}
